{
  "version": "0.22.10-artwork-geometry-unchanged",
  "world": {
    "width": 1870,
    "height": 2870,
    "units": "px"
  },
  "rooms": [
    {
      "id": "material",
      "x": 60,
      "y": 310,
      "w": 555,
      "h": 365,
      "title": "MATERIAL YARD",
      "floor": "#7d6748"
    },
    {
      "id": "staff",
      "x": 660,
      "y": 310,
      "w": 565,
      "h": 370,
      "title": "STAFF HOUSE",
      "floor": "#b59b74"
    },
    {
      "id": "training",
      "x": 1265,
      "y": 325,
      "w": 270,
      "h": 345,
      "title": "TRAINING YARD",
      "floor": "#8b7654"
    },
    {
      "id": "forge",
      "x": 55,
      "y": 730,
      "w": 580,
      "h": 435,
      "title": "FORGE (WEAPONS)",
      "floor": "#876b52"
    },
    {
      "id": "alchemy",
      "x": 660,
      "y": 730,
      "w": 595,
      "h": 435,
      "title": "ALCHEMY LAB",
      "floor": "#7e6c54"
    },
    {
      "id": "contract",
      "x": 1285,
      "y": 660,
      "w": 535,
      "h": 505,
      "title": "CONTRACT WAREHOUSE",
      "floor": "#7b6546"
    },
    {
      "id": "attack",
      "x": 80,
      "y": 1190,
      "w": 460,
      "h": 430,
      "title": "ATTACK PRODUCTS",
      "floor": "#c8ad7f"
    },
    {
      "id": "defense",
      "x": 550,
      "y": 1190,
      "w": 390,
      "h": 430,
      "title": "DEFENSE PRODUCTS",
      "floor": "#c8ad7f"
    },
    {
      "id": "other",
      "x": 950,
      "y": 1190,
      "w": 315,
      "h": 430,
      "title": "OTHER PRODUCTS",
      "floor": "#c8ad7f"
    },
    {
      "id": "rare",
      "x": 70,
      "y": 1645,
      "w": 315,
      "h": 400,
      "title": "RARE STORAGE",
      "floor": "#594563"
    },
    {
      "id": "counter",
      "x": 400,
      "y": 1640,
      "w": 865,
      "h": 400,
      "title": "CUSTOMER HALL & CHECKOUT",
      "floor": "#ccb285"
    },
    {
      "id": "management",
      "x": 1285,
      "y": 1350,
      "w": 425,
      "h": 690,
      "title": "MANAGEMENT & UPGRADES",
      "floor": "#a88d67"
    },
    {
      "id": "visitor",
      "x": 110,
      "y": 2150,
      "w": 410,
      "h": 360,
      "title": "SPECIAL VISITOR PLAZA",
      "floor": "#968463"
    },
    {
      "id": "gate",
      "x": 770,
      "y": 105,
      "w": 350,
      "h": 195,
      "title": "FOREST ADVENTURE GATE",
      "floor": "#5e7844"
    },
    {
      "id": "forest",
      "x": 120,
      "y": 60,
      "w": 1620,
      "h": 235,
      "title": "SLIME WOODS & RUINS",
      "floor": "#2d6830"
    }
  ],
  "walls": [
    {
      "id": "boundary-top",
      "x": 0,
      "y": 0,
      "w": 1870,
      "h": 24,
      "kind": "boundary"
    },
    {
      "id": "boundary-bottom",
      "x": 0,
      "y": 2846,
      "w": 1870,
      "h": 24,
      "kind": "boundary"
    },
    {
      "id": "boundary-left",
      "x": 0,
      "y": 0,
      "w": 24,
      "h": 2870,
      "kind": "boundary"
    },
    {
      "id": "boundary-right",
      "x": 1846,
      "y": 0,
      "w": 24,
      "h": 2870,
      "kind": "boundary"
    },
    {
      "id": "material-top-0",
      "x": 60,
      "y": 301,
      "w": 190,
      "h": 18,
      "kind": "wall"
    },
    {
      "id": "material-top-1",
      "x": 430,
      "y": 301,
      "w": 185,
      "h": 18,
      "kind": "wall"
    },
    {
      "id": "material-bottom-0",
      "x": 60,
      "y": 666,
      "w": 190,
      "h": 18,
      "kind": "wall"
    },
    {
      "id": "material-bottom-1",
      "x": 430,
      "y": 666,
      "w": 185,
      "h": 18,
      "kind": "wall"
    },
    {
      "id": "material-left-0",
      "x": 51,
      "y": 310,
      "w": 18,
      "h": 365,
      "kind": "wall"
    },
    {
      "id": "material-right-0",
      "x": 606,
      "y": 310,
      "w": 18,
      "h": 190,
      "kind": "wall"
    },
    {
      "id": "material-right-1",
      "x": 606,
      "y": 655,
      "w": 18,
      "h": 20,
      "kind": "wall"
    },
    {
      "id": "staff-top-0",
      "x": 660,
      "y": 301,
      "w": 170,
      "h": 18,
      "kind": "wall"
    },
    {
      "id": "staff-top-1",
      "x": 1010,
      "y": 301,
      "w": 215,
      "h": 18,
      "kind": "wall"
    },
    {
      "id": "staff-bottom-0",
      "x": 660,
      "y": 671,
      "w": 170,
      "h": 18,
      "kind": "wall"
    },
    {
      "id": "staff-bottom-1",
      "x": 1010,
      "y": 671,
      "w": 215,
      "h": 18,
      "kind": "wall"
    },
    {
      "id": "staff-left-0",
      "x": 651,
      "y": 310,
      "w": 18,
      "h": 190,
      "kind": "wall"
    },
    {
      "id": "staff-left-1",
      "x": 651,
      "y": 655,
      "w": 18,
      "h": 25,
      "kind": "wall"
    },
    {
      "id": "staff-right-0",
      "x": 1216,
      "y": 310,
      "w": 18,
      "h": 190,
      "kind": "wall"
    },
    {
      "id": "staff-right-1",
      "x": 1216,
      "y": 655,
      "w": 18,
      "h": 25,
      "kind": "wall"
    },
    {
      "id": "training-top-0",
      "x": 1265,
      "y": 316,
      "w": 45,
      "h": 18,
      "kind": "wall"
    },
    {
      "id": "training-top-1",
      "x": 1510,
      "y": 316,
      "w": 25,
      "h": 18,
      "kind": "wall"
    },
    {
      "id": "training-bottom-0",
      "x": 1265,
      "y": 661,
      "w": 45,
      "h": 18,
      "kind": "wall"
    },
    {
      "id": "training-bottom-1",
      "x": 1510,
      "y": 661,
      "w": 25,
      "h": 18,
      "kind": "wall"
    },
    {
      "id": "training-left-0",
      "x": 1256,
      "y": 325,
      "w": 18,
      "h": 155,
      "kind": "wall"
    },
    {
      "id": "training-left-1",
      "x": 1256,
      "y": 650,
      "w": 18,
      "h": 20,
      "kind": "wall"
    },
    {
      "id": "training-right-0",
      "x": 1526,
      "y": 325,
      "w": 18,
      "h": 345,
      "kind": "wall"
    },
    {
      "id": "forge-top-0",
      "x": 55,
      "y": 721,
      "w": 195,
      "h": 18,
      "kind": "wall"
    },
    {
      "id": "forge-top-1",
      "x": 440,
      "y": 721,
      "w": 195,
      "h": 18,
      "kind": "wall"
    },
    {
      "id": "forge-bottom-0",
      "x": 55,
      "y": 1156,
      "w": 195,
      "h": 18,
      "kind": "wall"
    },
    {
      "id": "forge-bottom-1",
      "x": 440,
      "y": 1156,
      "w": 195,
      "h": 18,
      "kind": "wall"
    },
    {
      "id": "forge-left-0",
      "x": 46,
      "y": 730,
      "w": 18,
      "h": 435,
      "kind": "wall"
    },
    {
      "id": "forge-right-0",
      "x": 626,
      "y": 730,
      "w": 18,
      "h": 170,
      "kind": "wall"
    },
    {
      "id": "forge-right-1",
      "x": 626,
      "y": 1145,
      "w": 18,
      "h": 20,
      "kind": "wall"
    },
    {
      "id": "alchemy-top-0",
      "x": 660,
      "y": 721,
      "w": 170,
      "h": 18,
      "kind": "wall"
    },
    {
      "id": "alchemy-top-1",
      "x": 1010,
      "y": 721,
      "w": 245,
      "h": 18,
      "kind": "wall"
    },
    {
      "id": "alchemy-bottom-0",
      "x": 660,
      "y": 1156,
      "w": 200,
      "h": 18,
      "kind": "wall"
    },
    {
      "id": "alchemy-bottom-1",
      "x": 1050,
      "y": 1156,
      "w": 205,
      "h": 18,
      "kind": "wall"
    },
    {
      "id": "alchemy-left-0",
      "x": 651,
      "y": 730,
      "w": 18,
      "h": 170,
      "kind": "wall"
    },
    {
      "id": "alchemy-left-1",
      "x": 651,
      "y": 1145,
      "w": 18,
      "h": 20,
      "kind": "wall"
    },
    {
      "id": "alchemy-right-0",
      "x": 1246,
      "y": 730,
      "w": 18,
      "h": 90,
      "kind": "wall"
    },
    {
      "id": "alchemy-right-1",
      "x": 1246,
      "y": 1010,
      "w": 18,
      "h": 155,
      "kind": "wall"
    },
    {
      "id": "contract-top-0",
      "x": 1285,
      "y": 651,
      "w": 25,
      "h": 18,
      "kind": "wall"
    },
    {
      "id": "contract-top-1",
      "x": 1510,
      "y": 651,
      "w": 310,
      "h": 18,
      "kind": "wall"
    },
    {
      "id": "contract-bottom-0",
      "x": 1285,
      "y": 1156,
      "w": 135,
      "h": 18,
      "kind": "wall"
    },
    {
      "id": "contract-bottom-1",
      "x": 1660,
      "y": 1156,
      "w": 160,
      "h": 18,
      "kind": "wall"
    },
    {
      "id": "contract-left-0",
      "x": 1276,
      "y": 660,
      "w": 18,
      "h": 160,
      "kind": "wall"
    },
    {
      "id": "contract-left-1",
      "x": 1276,
      "y": 1010,
      "w": 18,
      "h": 155,
      "kind": "wall"
    },
    {
      "id": "contract-right-0",
      "x": 1811,
      "y": 660,
      "w": 18,
      "h": 505,
      "kind": "wall"
    },
    {
      "id": "rare-top-0",
      "x": 70,
      "y": 1636,
      "w": 85,
      "h": 18,
      "kind": "wall"
    },
    {
      "id": "rare-top-1",
      "x": 320,
      "y": 1636,
      "w": 65,
      "h": 18,
      "kind": "wall"
    },
    {
      "id": "rare-bottom-0",
      "x": 70,
      "y": 2036,
      "w": 315,
      "h": 18,
      "kind": "wall"
    },
    {
      "id": "rare-left-0",
      "x": 61,
      "y": 1645,
      "w": 18,
      "h": 400,
      "kind": "wall"
    },
    {
      "id": "rare-right-0",
      "x": 376,
      "y": 1645,
      "w": 18,
      "h": 400,
      "kind": "wall"
    },
    {
      "id": "management-top-0",
      "x": 1285,
      "y": 1341,
      "w": 425,
      "h": 18,
      "kind": "wall"
    },
    {
      "id": "management-bottom-0",
      "x": 1285,
      "y": 2031,
      "w": 425,
      "h": 18,
      "kind": "wall"
    },
    {
      "id": "management-left-0",
      "x": 1276,
      "y": 1350,
      "w": 18,
      "h": 180,
      "kind": "wall"
    },
    {
      "id": "management-left-1",
      "x": 1276,
      "y": 1720,
      "w": 18,
      "h": 90,
      "kind": "wall"
    },
    {
      "id": "management-left-2",
      "x": 1276,
      "y": 1990,
      "w": 18,
      "h": 50,
      "kind": "wall"
    },
    {